{
  "$schema": "https://json-schema.org/draft/2020-12/schema",
  "$id": "https://latex-editor.local/schemas/resource.schema.json",
  "type": "object",
  "required": ["schemaVersion"],
  "properties": {
    "$schema": { "type": "string" },
    "schemaVersion": { "const": 1 },
    "id": { "type": "string", "minLength": 1 },
    "name": { "type": "string", "minLength": 1 },
    "commands": { "type": "array" },
    "environments": { "type": "array" },
    "previewEnvironments": { "type": "array" },
    "files": { "type": "array" },
    "executable": { "type": "string" },
    "arguments": { "type": "array", "items": { "type": "string" } },
    "timeoutMs": { "type": "integer" }
  },
  "additionalProperties": true
}
